{
  "schemaVersion": 1,
  "collection": "images",
  "note": "Curated image and photo applications. Every entry is reviewed by hand; nothing here is discovered, fetched or promoted automatically. The 'differences' field is written by the curator and is the only place a comparison between options may come from.",
  "entries": [
    {
      "entryId": "gimp",
      "applicationId": "org.gimp.GIMP",
      "name": "GIMP",
      "publisher": "The GIMP Development Team",
      "purpose": "Edit photographs and images: retouch, cut out, adjust colour, work in layers.",
      "capabilities": ["edit-image", "remove-background", "resize-image", "convert-image"],
      "packageSource": "flatpak",
      "packageReference": "org.gimp.GIMP",
      "license": "GPL-3.0-or-later",
      "cost": "free",
      "requiresAccount": false,
      "trustStatus": "flathub-verified",
      "updateMechanism": "flatpak",
      "optionKind": "open-source",
      "preferredBackend": "flatpak",
      "requiredPermissions": ["files", "gpu"],
      "optionalPermissions": ["folders", "notifications"],
      "permissionReasons": {
        "files": "to open the image you choose and save the result",
        "folders": "to work through a folder of images in one go",
        "gpu": "to make large images respond while you edit them",
        "notifications": "to tell you when a long export has finished"
      },
      "networkCeiling": "none",
      "sandboxCompatible": true,
      "differences": "Does most of what a commercial photo editor does, including layers, masks and colour work. It does not open Photoshop's PSD files perfectly — text layers and some adjustment layers come in flattened — and it has no cloud library, no subscription-only filters and no support desk. The interface is arranged differently and takes a while to learn if you know Photoshop.",
      "hardware": { "memoryBytes": 4294967296, "diskBytes": 1073741824, "needsGpu": false, "architectures": ["x86_64", "aarch64"] }
    },
    {
      "entryId": "krita",
      "applicationId": "org.kde.krita",
      "name": "Krita",
      "publisher": "Krita Foundation",
      "purpose": "Paint and draw: digital painting, illustration, concept art.",
      "capabilities": ["edit-image", "paint-image", "convert-image"],
      "packageSource": "flatpak",
      "packageReference": "org.kde.krita",
      "license": "GPL-3.0-or-later",
      "cost": "free",
      "requiresAccount": false,
      "trustStatus": "flathub-verified",
      "updateMechanism": "flatpak",
      "optionKind": "open-source",
      "preferredBackend": "flatpak",
      "requiredPermissions": ["files", "gpu"],
      "optionalPermissions": ["folders"],
      "permissionReasons": {
        "files": "to open and save the picture you are working on",
        "folders": "to keep a project's files together",
        "gpu": "to keep brushes responsive on a large canvas"
      },
      "networkCeiling": "none",
      "sandboxCompatible": true,
      "differences": "Built for painting rather than for photo editing. Brush engines are its strength; it is a poor choice for retouching a photograph or laying out a page. Reads PSD files better than most, writes them adequately.",
      "hardware": { "memoryBytes": 4294967296, "diskBytes": 1073741824, "needsGpu": false, "architectures": ["x86_64"] }
    },
    {
      "entryId": "adobe-photoshop",
      "applicationId": "com.adobe.Photoshop",
      "name": "Adobe Photoshop",
      "publisher": "Adobe Inc.",
      "purpose": "The commercial standard for photo editing and compositing.",
      "capabilities": ["edit-image", "remove-background", "resize-image", "convert-image", "paint-image"],
      "packageSource": "web",
      "packageReference": "https://www.adobe.com/products/photoshop.html",
      "license": "Proprietary",
      "cost": "subscription",
      "requiresAccount": true,
      "trustStatus": "vendor",
      "updateMechanism": "vendor-updater",
      "optionKind": "commercial",
      "preferredBackend": "systemd-scope",
      "requiredPermissions": [],
      "optionalPermissions": [],
      "networkCeiling": "none",
      "sandboxCompatible": false,
      "sandboxNote": "Adobe does not publish a Linux build. Bunny cannot install it, cannot put it in a capsule and cannot promise anything about it. It is listed so you know it exists and what it would cost.",
      "differences": "The reference product. Best PSD support, best commercial plug-in ecosystem, subscription-only, requires an Adobe account, and has no Linux version at all — so on this computer it is not an option Bunny can offer, only one it can tell you about.",
      "hardware": { "memoryBytes": 8589934592, "diskBytes": 21474836480, "needsGpu": true, "architectures": ["x86_64"] }
    },
    {
      "entryId": "photopea",
      "applicationId": "com.photopea.Photopea",
      "name": "Photopea",
      "publisher": "Ivan Kutskir",
      "purpose": "Photoshop-like image editing in a browser tab.",
      "capabilities": ["edit-image", "remove-background", "resize-image", "convert-image"],
      "packageSource": "web",
      "packageReference": "https://www.photopea.com/",
      "license": "Proprietary",
      "cost": "freemium",
      "requiresAccount": false,
      "trustStatus": "vendor",
      "updateMechanism": "none",
      "optionKind": "web",
      "preferredBackend": "systemd-scope",
      "requiredPermissions": [],
      "optionalPermissions": [],
      "networkCeiling": "none",
      "sandboxCompatible": false,
      "sandboxNote": "This runs in a web page, so the isolation is the browser's rather than Bunny's, and Bunny cannot tell you what happens to a file after you upload it.",
      "differences": "Opens PSD files well and is free to use with adverts. Your image goes to a web page rather than staying on this computer, which is the difference that matters if the picture is private.",
      "hardware": { "architectures": ["x86_64", "aarch64"] }
    },
    {
      "entryId": "imagemagick",
      "applicationId": "org.imagemagick.ImageMagick",
      "name": "ImageMagick",
      "publisher": "ImageMagick Studio LLC",
      "purpose": "Convert, resize and batch-process images without a window.",
      "capabilities": ["convert-image", "resize-image", "remove-background"],
      "packageSource": "fedora-rpm",
      "packageReference": "/usr/bin/magick",
      "license": "ImageMagick",
      "cost": "free",
      "requiresAccount": false,
      "trustStatus": "distribution",
      "updateMechanism": "bootc-image",
      "optionKind": "open-source",
      "preferredBackend": "bubblewrap",
      "requiredPermissions": ["files"],
      "optionalPermissions": ["folders"],
      "permissionReasons": {
        "files": "to read the image you named and write the converted one",
        "folders": "to convert a whole folder at once"
      },
      "networkCeiling": "none",
      "sandboxCompatible": true,
      "differences": "Has no window at all — Bunny drives it for you. Excellent at conversion, resizing and simple batch work; it cannot do the interactive editing GIMP and Krita are for, and its background removal is a colour-key rather than the subject detection a photo editor does.",
      "hardware": { "memoryBytes": 1073741824, "architectures": ["x86_64", "aarch64"] }
    }
  ]
}
